{
  "solverInfo": {
    "solverName": "HFSS",
    "solverVersion": "HFSS",
    "method": "FEM"
  },
  "geometrySummary": {
    "entityCount": 0,
    "entityTypes": {}
  },
  "meshSummary": {},
  "materialSummary": [
    {
      "name": "aluminum",
      "type": "conductor"
    },
    {
      "name": "vacuum",
      "type": "dielectric"
    }
  ],
  "portSummary": [],
  "boundaryConditionSummary": [],
  "frequencySetup": {},
  "fileSummary": {
    "inputFiles": [
      "Yagi_Uda.hfss"
    ],
    "outputFiles": []
  }
}